{
  "schema_version": 1,
  "distribution_id": "paw-codex-manual",
  "version": "0.1.0-candidate.9",
  "status": "candidate",
  "compatibility": {
    "schema_versions": [
      1,
      2
    ],
    "toolkit": "codex-candidate",
    "codex_runtime": "codex-paw-candidate"
  },
  "requirements": {
    "node": ">=20"
  },
  "license": "MPL-2.0",
  "notices": [
    "NOTICES.md"
  ],
  "files": [
    {
      "source_path": ".codex/README.md",
      "destination_path": ".codex/README.md",
      "kind": "runtime-binding",
      "checksum_sha256": "15f51e43f9544e79ca0cc7038a9c17be3046d1fae6b8b1c5ad7da08de7106c6f",
      "license": "MPL-2.0",
      "required_for_codex": true,
      "uninstall_owned": true
    },
    {
      "source_path": ".codex/agents/paw-artifact-writer.toml",
      "destination_path": ".codex/agents/paw-artifact-writer.toml",
      "kind": "runtime-binding",
      "checksum_sha256": "57fff2594ca3c98c60e3555d0ef1b4e067161959042ffe16fc544f48ede014bf",
      "license": "MPL-2.0",
      "required_for_codex": true,
      "uninstall_owned": true
    },
    {
      "source_path": ".codex/agents/paw-contract-reader.toml",
      "destination_path": ".codex/agents/paw-contract-reader.toml",
      "kind": "runtime-binding",
      "checksum_sha256": "6dceea15af6de3058b2268c03e4394bcb24fca499fa5f0c57423f2668adb8559",
      "license": "MPL-2.0",
      "required_for_codex": true,
      "uninstall_owned": true
    },
    {
      "source_path": ".codex/agents/paw-risk-reviewer.toml",
      "destination_path": ".codex/agents/paw-risk-reviewer.toml",
      "kind": "runtime-binding",
      "checksum_sha256": "72e140a8911f7527bcb930da5fbb0a47f00b3ad7c2beda5cc24982322791a3e5",
      "license": "MPL-2.0",
      "required_for_codex": true,
      "uninstall_owned": true
    },
    {
      "source_path": ".codex/paw-runtime-map.json",
      "destination_path": ".codex/paw-runtime-map.json",
      "kind": "runtime-binding",
      "checksum_sha256": "8763f617b048e6f07e6c38de97180e12e1f4d47c93b8ea776efa84db95a4b087",
      "license": "MPL-2.0",
      "required_for_codex": true,
      "uninstall_owned": true
    },
    {
      "source_path": ".codex/paw-toolkit/README.md",
      "destination_path": ".codex/paw-toolkit/README.md",
      "kind": "runtime-binding",
      "checksum_sha256": "e7554476fd2c4efcbb18ccd6273472f5c3fcddf9a1cb90ed0b595ba04f38f453",
      "license": "MPL-2.0",
      "required_for_codex": true,
      "uninstall_owned": true
    },
    {
      "source_path": ".codex/paw-toolkit/bin/paw-codex-toolkit.mjs",
      "destination_path": ".codex/paw-toolkit/bin/paw-codex-toolkit.mjs",
      "kind": "runtime-binding",
      "checksum_sha256": "c018cb4a7af706c0e0f9dcc39b61285266dff54b2214d7b81a361f39704c4fa6",
      "license": "MPL-2.0",
      "required_for_codex": true,
      "uninstall_owned": true
    },
    {
      "source_path": ".codex/paw-toolkit/providers/github.mjs",
      "destination_path": ".codex/paw-toolkit/providers/github.mjs",
      "kind": "runtime-binding",
      "checksum_sha256": "9dbd0c29d31dfa1114b759cfdde3a969f6312ae71afe4c272fd2954de3f52a03",
      "license": "MPL-2.0",
      "required_for_codex": true,
      "uninstall_owned": true
    },
    {
      "source_path": ".codex/skills/paw-bootstrap-define/SKILL.md",
      "destination_path": ".codex/skills/paw-bootstrap-define/SKILL.md",
      "kind": "runtime-binding",
      "checksum_sha256": "21f8437422cf28f66938c4a74825ab857200c3a97e384ffe971db352e9b65a6d",
      "license": "MPL-2.0",
      "required_for_codex": true,
      "uninstall_owned": true
    },
    {
      "source_path": ".codex/skills/paw-bootstrap-discover/SKILL.md",
      "destination_path": ".codex/skills/paw-bootstrap-discover/SKILL.md",
      "kind": "runtime-binding",
      "checksum_sha256": "5eb2ecbcdea60f1d86909d316bc7e8595ded35528e87655ab95c29adc33a03f2",
      "license": "MPL-2.0",
      "required_for_codex": true,
      "uninstall_owned": true
    },
    {
      "source_path": ".codex/skills/paw-bootstrap-write/SKILL.md",
      "destination_path": ".codex/skills/paw-bootstrap-write/SKILL.md",
      "kind": "runtime-binding",
      "checksum_sha256": "f3dfaa7e11f79d6c80d6d369668979a520930339d30d4107a4c2ebf76a2cec2e",
      "license": "MPL-2.0",
      "required_for_codex": true,
      "uninstall_owned": true
    },
    {
      "source_path": ".codex/skills/paw-close/SKILL.md",
      "destination_path": ".codex/skills/paw-close/SKILL.md",
      "kind": "runtime-binding",
      "checksum_sha256": "e434829aec056f53c52b588ad81309b3e7d2389de32dc2982756af7acd7bc557",
      "license": "MPL-2.0",
      "required_for_codex": true,
      "uninstall_owned": true
    },
    {
      "source_path": ".codex/skills/paw-conformance/SKILL.md",
      "destination_path": ".codex/skills/paw-conformance/SKILL.md",
      "kind": "runtime-binding",
      "checksum_sha256": "24df72768d384850793852d66470a9c80e098efd2dcf7576e267ee90cff6f009",
      "license": "MPL-2.0",
      "required_for_codex": true,
      "uninstall_owned": true
    },
    {
      "source_path": ".codex/skills/paw-execute-phase/SKILL.md",
      "destination_path": ".codex/skills/paw-execute-phase/SKILL.md",
      "kind": "runtime-binding",
      "checksum_sha256": "1f259234ff0fbf7eca28dcf410cfd31722d39b2dddbb796f430904d9c2ec3a63",
      "license": "MPL-2.0",
      "required_for_codex": true,
      "uninstall_owned": true
    },
    {
      "source_path": ".codex/skills/paw-intake/SKILL.md",
      "destination_path": ".codex/skills/paw-intake/SKILL.md",
      "kind": "runtime-binding",
      "checksum_sha256": "173397f57efd9871c16480e4473c0a550b1c800422650a9e124930e69fa45f3e",
      "license": "MPL-2.0",
      "required_for_codex": true,
      "uninstall_owned": true
    },
    {
      "source_path": ".codex/skills/paw-integrate/SKILL.md",
      "destination_path": ".codex/skills/paw-integrate/SKILL.md",
      "kind": "runtime-binding",
      "checksum_sha256": "7595494ccdea52140b2e94409a6556364374674e92d1e4e38ec8ab343c78a72e",
      "license": "MPL-2.0",
      "required_for_codex": true,
      "uninstall_owned": true
    },
    {
      "source_path": ".codex/skills/paw-phase-backlog/SKILL.md",
      "destination_path": ".codex/skills/paw-phase-backlog/SKILL.md",
      "kind": "runtime-binding",
      "checksum_sha256": "375495575f08f0127f00d6cdf2e67999b21878f58ca32eda4f6d09a8a79742be",
      "license": "MPL-2.0",
      "required_for_codex": true,
      "uninstall_owned": true
    },
    {
      "source_path": ".codex/skills/paw-plan/SKILL.md",
      "destination_path": ".codex/skills/paw-plan/SKILL.md",
      "kind": "runtime-binding",
      "checksum_sha256": "db712309c3b83804ecfdc376f16effc7efe4b05a4524aa53dfcd8ec88d441248",
      "license": "MPL-2.0",
      "required_for_codex": true,
      "uninstall_owned": true
    },
    {
      "source_path": ".codex/skills/paw-router/SKILL.md",
      "destination_path": ".codex/skills/paw-router/SKILL.md",
      "kind": "runtime-binding",
      "checksum_sha256": "bdff88bc875b4bad9735f127c1c89a8fae54962e04f2ae3a6622481044a744a0",
      "license": "MPL-2.0",
      "required_for_codex": true,
      "uninstall_owned": true
    },
    {
      "source_path": ".codex/skills/paw-sync-drift/SKILL.md",
      "destination_path": ".codex/skills/paw-sync-drift/SKILL.md",
      "kind": "runtime-binding",
      "checksum_sha256": "0b58e1535de683925b2da7a7caa3092423bbe0a85eff55469adf19ed512b87e1",
      "license": "MPL-2.0",
      "required_for_codex": true,
      "uninstall_owned": true
    },
    {
      "source_path": ".codex/skills/paw-tasks/SKILL.md",
      "destination_path": ".codex/skills/paw-tasks/SKILL.md",
      "kind": "runtime-binding",
      "checksum_sha256": "089efcf5b99af80046726d3bcfb1b171ccf50b4757371c9c8c825231fda7b248",
      "license": "MPL-2.0",
      "required_for_codex": true,
      "uninstall_owned": true
    },
    {
      "source_path": ".codex/skills/paw-triage/SKILL.md",
      "destination_path": ".codex/skills/paw-triage/SKILL.md",
      "kind": "runtime-binding",
      "checksum_sha256": "220d2e235d49e37b63d8d62f6a4f4a86bc3e431280c048931be3df6fc502efc1",
      "license": "MPL-2.0",
      "required_for_codex": true,
      "uninstall_owned": true
    },
    {
      "source_path": "AGENTS.md",
      "destination_path": "AGENTS.md",
      "kind": "documentation",
      "checksum_sha256": "dd04578bbffed140b8cc4f17fbf49f6bf0a7c19de5469c16f20e0b686e56ac14",
      "license": "MPL-2.0",
      "required_for_codex": false,
      "uninstall_owned": true
    },
    {
      "source_path": "LICENSE",
      "destination_path": "LICENSE",
      "kind": "license",
      "checksum_sha256": "cde215e5b42363eb28ca2462c4558ff4807b38f383c537624c31e44657ac58f4",
      "license": "MPL-2.0",
      "required_for_codex": true,
      "uninstall_owned": true
    },
    {
      "source_path": "NOTICES.md",
      "destination_path": "NOTICES.md",
      "kind": "notice",
      "checksum_sha256": "18fc8da5b8d81c3d3b2723f46b9e0b2df5f54c6b9bec9bd78202bc7108810dc6",
      "license": "MPL-2.0",
      "required_for_codex": true,
      "uninstall_owned": true
    },
    {
      "source_path": "README.md",
      "destination_path": "README.md",
      "kind": "documentation",
      "checksum_sha256": "39f6164fb7a5faddaba0b70b64d67fb8bca8a3b430870dc68640d801f91a79c8",
      "license": "MPL-2.0",
      "required_for_codex": true,
      "uninstall_owned": true
    },
    {
      "source_path": "docs/README.md",
      "destination_path": "docs/README.md",
      "kind": "contract",
      "checksum_sha256": "32530561f12bc47e935bb0f1f8dab036fe1b01e1cd96fb8fab5ccd5d8645206f",
      "license": "MPL-2.0",
      "required_for_codex": true,
      "uninstall_owned": true
    },
    {
      "source_path": "docs/governance/ARCHITECTURE.md",
      "destination_path": "docs/governance/ARCHITECTURE.md",
      "kind": "contract",
      "checksum_sha256": "df42d47652c42714229881d20773fcc3dcf7971ef82eb2a71171491419ab123b",